[
  {
    "action_id": "ACT-0002",
    "action_name": "daily_priority_brief",
    "action_category": "CEO_LEVERAGE",
    "action_subcategory": "decision_queue",
    "action_description": "Generate a structured daily brief delivered at 6:30 AM: top 3 decisions needed, top 3 revenue risks, top 3 open commitments, and calendar summary for the day.",
    "business_goal": "CEO starts each day with a clear operating picture instead of inbox archaeology.",
    "expected_value_type": "time_saved",
    "value_score": 10,
    "frequency_score": 10,
    "time_saved_score": 9,
    "profit_impact_score": 8,
    "risk_score": 1,
    "confidence_score": 10,
    "status": "enabled",
    "execution_mode": "auto_execute",
    "trigger_type": "scheduled",
    "trigger_definition": "Daily at 06:30 local time. Aggregate from memory store, calendar, and open action items.",
    "required_inputs": [
      "calendar events",
      "open_action_items",
      "memory_store"
    ],
    "optional_inputs": [
      "email summaries",
      "deal status"
    ],
    "system_dependencies": [
      "calendar_connector",
      "memory",
      "email_connector"
    ],
    "owner": "OpenClaw",
    "approver": "none",
    "escalation_path": "none",
    "success_metric": "Brief delivered by 06:35 every business day",
    "failure_metric": "Brief not delivered or missing any of the 3 required sections",
    "estimated_hours_saved_per_month": 5.0,
    "enabled": true,
    "tags": [
      "ceo",
      "brief",
      "daily",
      "decisions"
    ],
    "composite_score": 7.286,
    "rank": 1
  },
  {
    "action_id": "ACT-0001",
    "action_name": "stale_deal_followup_prompt",
    "action_category": "REVENUE_ACCELERATION",
    "action_subcategory": "pipeline_hygiene",
    "action_description": "Detect deals with no activity in 7+ days. Draft a follow-up email to the relevant contact and surface it for CEO review.",
    "business_goal": "Prevent deal leakage from inaction. Every stale deal is money sitting on the table.",
    "expected_value_type": "revenue",
    "value_score": 10,
    "frequency_score": 9,
    "time_saved_score": 7,
    "profit_impact_score": 10,
    "risk_score": 2,
    "confidence_score": 9,
    "status": "approved",
    "execution_mode": "draft_then_review",
    "trigger_type": "scheduled",
    "trigger_definition": "Daily at 07:00. Query CRM for deals where last_activity < now-7d and stage not in [closed_won, closed_lost].",
    "required_inputs": [
      "CRM deal list",
      "contact email addresses",
      "last activity timestamps"
    ],
    "optional_inputs": [
      "deal notes",
      "prior email thread"
    ],
    "system_dependencies": [
      "crm_connector",
      "email_connector"
    ],
    "owner": "CEO",
    "approver": "CEO",
    "escalation_path": "CEO inbox",
    "success_metric": "Follow-up sent within 24h of detection",
    "failure_metric": "Deal goes 14+ days with no activity",
    "estimated_hours_saved_per_month": 6.0,
    "enabled": true,
    "tags": [
      "revenue",
      "pipeline",
      "crm",
      "email"
    ],
    "composite_score": 7.048,
    "rank": 2
  },
  {
    "action_id": "ACT-0007",
    "action_name": "weekly_pipeline_review_pack",
    "action_category": "REVENUE_ACCELERATION",
    "action_subcategory": "pipeline_visibility",
    "action_description": "Every Monday generate a structured pipeline review pack: all active deals by stage, changes since last week, at-risk deals, required next steps, and deal velocity metrics.",
    "business_goal": "CEO sees the full revenue picture in 5 minutes, not 45.",
    "expected_value_type": "revenue",
    "value_score": 9,
    "frequency_score": 9,
    "time_saved_score": 8,
    "profit_impact_score": 9,
    "risk_score": 1,
    "confidence_score": 9,
    "status": "enabled",
    "execution_mode": "auto_execute",
    "trigger_type": "scheduled",
    "trigger_definition": "Monday at 07:00.",
    "required_inputs": [
      "crm_deals",
      "stage_history"
    ],
    "optional_inputs": [
      "deal_notes",
      "meeting_history"
    ],
    "system_dependencies": [
      "crm_connector",
      "memory"
    ],
    "owner": "OpenClaw",
    "approver": "none",
    "escalation_path": "none",
    "success_metric": "Pack delivered by Monday 07:15",
    "failure_metric": "Pack delayed past 09:00",
    "estimated_hours_saved_per_month": 4.0,
    "enabled": true,
    "tags": [
      "pipeline",
      "revenue",
      "weekly",
      "crm"
    ],
    "composite_score": 6.952,
    "rank": 3
  },
  {
    "action_id": "ACT-0006",
    "action_name": "invoice_overdue_followup",
    "action_category": "REVENUE_ACCELERATION",
    "action_subcategory": "collections",
    "action_description": "Detect invoices past due by 7, 14, or 30 days. Draft escalating follow-up emails keyed to the overdue tier. Present for approval before send.",
    "business_goal": "Collect what is owed. Every overdue invoice is a zero-interest loan to the customer.",
    "expected_value_type": "revenue",
    "value_score": 10,
    "frequency_score": 8,
    "time_saved_score": 7,
    "profit_impact_score": 10,
    "risk_score": 3,
    "confidence_score": 9,
    "status": "approved",
    "execution_mode": "draft_then_review",
    "trigger_type": "scheduled",
    "trigger_definition": "Daily at 08:00. Query accounting system for invoices where due_date < today and status != paid.",
    "required_inputs": [
      "invoice list",
      "customer contact info",
      "due dates"
    ],
    "optional_inputs": [
      "prior collection notes",
      "payment history"
    ],
    "system_dependencies": [
      "accounting_connector",
      "email_connector"
    ],
    "owner": "Operations",
    "approver": "CEO",
    "escalation_path": "CEO for 30+ day overdue",
    "success_metric": "Follow-up sent within 24h of detection",
    "failure_metric": "Invoice reaches 45 days with no contact",
    "estimated_hours_saved_per_month": 5.0,
    "enabled": true,
    "tags": [
      "revenue",
      "collections",
      "invoices",
      "finance"
    ],
    "composite_score": 6.714,
    "rank": 4
  },
  {
    "action_id": "ACT-0014",
    "action_name": "proposal_followup_prompt",
    "action_category": "REVENUE_ACCELERATION",
    "action_subcategory": "proposal_velocity",
    "action_description": "After a proposal is sent, trigger follow-up prompts at 3, 7, and 14 days if no response. Draft email at each interval. Escalate to CEO at 14 days.",
    "business_goal": "Proposals that go dark die. Systematic follow-up keeps momentum.",
    "expected_value_type": "revenue",
    "value_score": 10,
    "frequency_score": 7,
    "time_saved_score": 6,
    "profit_impact_score": 10,
    "risk_score": 2,
    "confidence_score": 9,
    "status": "approved",
    "execution_mode": "draft_then_review",
    "trigger_type": "event_driven",
    "trigger_definition": "Trigger on proposal_sent event. Then schedule follow-ups at T+3d, T+7d, T+14d if response_received=false.",
    "required_inputs": [
      "proposal_sent_date",
      "recipient_email",
      "proposal_summary"
    ],
    "optional_inputs": [
      "deal value",
      "prior relationship notes"
    ],
    "system_dependencies": [
      "crm_connector",
      "email_connector"
    ],
    "owner": "CEO",
    "approver": "CEO",
    "escalation_path": "CEO at 14 days",
    "success_metric": "Response obtained or deal closed within 21 days of proposal",
    "failure_metric": "Proposal goes dark >21 days with no logged contact",
    "estimated_hours_saved_per_month": 4.0,
    "enabled": true,
    "tags": [
      "proposals",
      "revenue",
      "follow-up",
      "sales"
    ],
    "composite_score": 6.619,
    "rank": 5
  },
  {
    "action_id": "ACT-0003",
    "action_name": "pre_meeting_dossier",
    "action_category": "CEO_LEVERAGE",
    "action_subcategory": "meeting_preparation",
    "action_description": "60 minutes before any external meeting, auto-generate a dossier: who is attending, their company, last interaction, open deals, relevant context from memory, and 3 suggested talking points.",
    "business_goal": "CEO enters every meeting prepared. No prep time wasted. No missed context.",
    "expected_value_type": "time_saved",
    "value_score": 9,
    "frequency_score": 8,
    "time_saved_score": 9,
    "profit_impact_score": 7,
    "risk_score": 1,
    "confidence_score": 9,
    "status": "enabled",
    "execution_mode": "auto_execute",
    "trigger_type": "event_driven",
    "trigger_definition": "Trigger T-60min before any calendar event with \u22651 external attendee.",
    "required_inputs": [
      "calendar_event",
      "attendee_list",
      "memory_store"
    ],
    "optional_inputs": [
      "crm_deal_status",
      "prior_email_thread"
    ],
    "system_dependencies": [
      "calendar_connector",
      "memory",
      "crm_connector"
    ],
    "owner": "OpenClaw",
    "approver": "none",
    "escalation_path": "none",
    "success_metric": "Dossier delivered \u226545 min before meeting",
    "failure_metric": "Dossier delivered <15 min before meeting or not at all",
    "estimated_hours_saved_per_month": 8.0,
    "enabled": true,
    "tags": [
      "ceo",
      "meeting",
      "dossier",
      "preparation"
    ],
    "composite_score": 6.476,
    "rank": 6
  },
  {
    "action_id": "ACT-0019",
    "action_name": "focus_block_protection",
    "action_category": "CEO_LEVERAGE",
    "action_subcategory": "calendar_management",
    "action_description": "Detect weeks where CEO has <4 hours of uninterrupted focus blocks. Recommend calendar edits to create or protect focus time. Flag when external requests erode them.",
    "business_goal": "Deep work requires time. Calendar without protection fills with noise.",
    "expected_value_type": "time_saved",
    "value_score": 9,
    "frequency_score": 8,
    "time_saved_score": 10,
    "profit_impact_score": 7,
    "risk_score": 1,
    "confidence_score": 7,
    "status": "approved",